{
  "$schema": "https://json-schema.org/draft/2020-12/schema",
  "$id": "mem0_capability_api_contract.schema.json",
  "title": "Post-login Mem0 capability API contract",
  "type": "object",
  "additionalProperties": false,
  "required": ["schema_version", "status_schema_version", "execution", "authorization", "routes", "error_codes"],
  "properties": {
    "schema_version": {"const": "olivia.mem0-capability-api-contract.v1"},
    "status_schema_version": {"const": "olivia.capability-status.v2"},
    "execution": {"const": "per-installer-serialized-off-event-loop"},
    "authorization": {
      "const": {
        "origins": "explicit-trusted-https-or-loopback-only",
        "login_required_for_mutations": true,
        "session_header": "X-Olivia-Setup-Session",
        "confirmation_header": {"name": "X-Olivia-Capability-Action", "value": "confirmed"}
      }
    },
    "routes": {
      "type": "object",
      "additionalProperties": false,
      "required": ["/toy/capabilities/mem0", "/toy/capabilities/mem0/action"],
      "properties": {
        "/toy/capabilities/mem0": {"$ref": "#/$defs/route"},
        "/toy/capabilities/mem0/action": {"$ref": "#/$defs/route"}
      }
    },
    "error_codes": {
      "type": "object",
      "additionalProperties": false,
      "required": [
        "CAPABILITY_ACTION_UNAVAILABLE", "CAPABILITY_CONFIRMATION_REQUIRED",
        "CAPABILITY_CONTENT_TYPE_INVALID", "CAPABILITY_FIELDS_INVALID",
        "CAPABILITY_HOST_FORBIDDEN", "CAPABILITY_JSON_INVALID",
        "CAPABILITY_LOGIN_REQUIRED", "CAPABILITY_OFFLINE_ARCHIVE_INVALID",
        "CAPABILITY_OFFLINE_PICKER_UNAVAILABLE", "CAPABILITY_ORIGIN_FORBIDDEN",
        "CAPABILITY_REQUEST_TOO_LARGE", "CAPABILITY_RESULT_INVALID",
        "CAPABILITY_STATUS_INVALID", "CAPABILITY_STATUS_UNAVAILABLE"
      ],
      "patternProperties": {"^CAPABILITY_[A-Z_]+$": {"$ref": "#/$defs/error"}}
    }
  },
  "$defs": {
    "route": {
      "type": "object",
      "additionalProperties": false,
      "required": ["methods", "status_values", "request_fields", "response_fields"],
      "properties": {
        "methods": {"type": "array", "minItems": 2, "uniqueItems": true, "items": {"enum": ["GET", "POST", "OPTIONS"]}},
        "status_values": {"type": "array", "minItems": 1, "uniqueItems": true, "items": {"type": "string"}},
        "request_fields": {"type": "array", "uniqueItems": true, "items": {"type": "string"}},
        "response_fields": {"type": "array", "minItems": 1, "uniqueItems": true, "items": {"type": "string"}}
      }
    },
    "error": {
      "type": "object",
      "additionalProperties": false,
      "required": ["http_statuses", "status", "response_fields"],
      "properties": {
        "http_statuses": {"type": "array", "minItems": 1, "uniqueItems": true, "items": {"type": "integer", "minimum": 400, "maximum": 599}},
        "status": {"const": "FAILED"},
        "response_fields": {"const": ["status", "error_code"]}
      }
    }
  }
}
